ID,Question,Real_Answer,Answer_ModelFile_CT,Answer_ModelFile_CA,Answer_ModelFile_IT,Answer_ModelFile_IA
35,Who discovered penicillin?,Alexander Fleming,Alexander Fleming,"The correct answer is Alexander Fleming.<br><br>Here's a comprehensive explanation of the ""WHY"" and ""HOW"":<br><br>Alexander Fleming was a Scottish biologist, pharmacologist, and botanist who discovered penicillin in 1928. At the time, Fleming was working at St. Mary's Hospital in London, where he was studying the bacteria that caused pneumonia.<br><br>Fleming noticed that one of his bacterial cultures had been contaminated with a mold, which had killed off the surrounding bacteria. He isolated the substance responsible for this effect and named it penicillin.<br><br>Penicillin is a type of antibiotic that is produced by certain species of fungi, including Penicillium notatum. Fleming's discovery of penicillin revolutionized the treatment of bacterial infections, as it provided a natural and effective way to combat many types of bacteria that had previously been resistant to treatment.<br><br>Fleming's work was influenced by his studies of the biology of microorganisms and his interest in developing new treatments for infectious diseases. He was also inspired by the work of other scientists who were studying the properties of mold and fungi.<br><br>The discovery of penicillin has had a profound impact on medicine and public health. It has saved countless lives and has been instrumental in reducing the incidence of bacterial infections worldwide.<br><br>In conclusion, Alexander Fleming is credited with discovering penicillin, which revolutionized the treatment of bacterial infections and has had a lasting impact on medicine and public health. His work remains an integral part of modern medicine and continues to inspire new generations of scientists and physicians.",Hawking,"Alexander Fleming is widely recognized for discovering penicillin, a natural antibiotic that has revolutionized the treatment of bacterial infections."
36,Who is known as the father of psychoanalysis?,Sigmund Freud,Sigmund Freud,"The correct answer is Sigmund Freud.<br><br>Here's a comprehensive explanation of the ""WHY"" and ""HOW"":<br><br>Sigmund Freud was an Austrian neurologist and founder of psychoanalysis who developed a comprehensive theory of human behavior, personality development, and mental functioning. He is widely regarded as the father of psychoanalysis.<br><br>Freud's work focused on the unconscious mind and its role in shaping human behavior, emotions, and thoughts. He believed that childhood experiences, including traumatic events and repressed memories, played a significant role in shaping adult personality and behavior.<br><br>Freud's theories were influenced by his studies of hypnosis, hysteria, and other psychological phenomena. He was also inspired by the works of earlier thinkers such as Charles Darwin, Jean-Martin Charcot, and Wilhelm Wundt.<br><br>Some of Freud's key concepts include:<br><br>1. The unconscious mind: Freud believed that a significant portion of our thoughts, feelings, and behaviors are outside of conscious awareness but still influence our actions.<br>2. Repression: Freud proposed that traumatic or unpleasant memories can be repressed, or pushed into the unconscious mind, to avoid conscious awareness.<br>3. Psychoanalytic theory: Freud developed a comprehensive theory of human behavior and personality development that emphasized the role of childhood experiences, the unconscious mind, and repression.<br><br>Freud's work has had a profound impact on psychology, psychiatry, and psychotherapy. His theories have influenced many other psychologists and psychoanalysts, including Carl Jung, Erik Erikson, and Jacques Lacan.<br><br>In conclusion, Sigmund Freud is widely regarded as the father of psychoanalysis due to his groundbreaking work in developing a comprehensive theory of human behavior, personality development, and mental functioning. His theories continue to shape our understanding of the human psyche and have had a lasting impact on psychology, psychiatry, and psychotherapy.",Curie,"Sigmund Freud is universally regarded as the father of psychoanalysis, a pioneering psychologist who developed the theories and techniques of psychoanalytic therapy."
37,Who proposed the theory of evolution by natural selection?,Charles Darwin,Charles Darwin,"The correct answer is Charles Darwin.<br><br>Here's a comprehensive explanation of the ""WHY"" and ""HOW"":<br><br>Charles Darwin was an English naturalist who proposed the theory of evolution by natural selection in his groundbreaking book ""On the Origin of Species"" published in 1859. The theory of evolution by natural selection suggests that all species of life have evolved over time through the process of variation, mutation, genetic drift, and gene flow.<br><br>Darwin's work was influenced by his observations during his five-year voyage on the HMS Beagle, where he collected numerous specimens and made detailed notes on their characteristics. He was also inspired by the works of earlier scientists such as Thomas Malthus, Jean-Baptiste Lamarck, and Alfred Russel Wallace.<br><br>Some key concepts in Darwin's theory include:<br><br>1. Variation: Darwin proposed that all species exhibit variation in their characteristics, which is the raw material for evolution.<br>2. Heredity: He recognized that offspring inherit traits from their parents through the transmission of genetic information.<br>3. Adaptation: Darwin suggested that organisms adapt to their environments by developing characteristics that enhance their survival and reproductive success.<br>4. Natural selection: He proposed that natural selection acts on the variation in a population, favoring individuals with advantageous traits that help them survive and reproduce better.<br><br>Darwin's theory of evolution by natural selection has had a profound impact on our understanding of biology, ecology, and conservation. It has led to numerous breakthroughs in fields such as medicine, agriculture, and environmental science.<br><br>In conclusion, Charles Darwin is credited with proposing the theory of evolution by natural selection, which revolutionized our understanding of the diversity of life on Earth. His work remains an integral part of modern biology and continues to inspire new generations of scientists and philosophers.",Tesla,"Charles Darwin is credited with proposing the theory of evolution by natural selection in his groundbreaking book ""On the Origin of Species"" published in 1859."
38,In which year did World War I begin?,1914,1914,"The correct answer is 1914.<br><br>World War I began on July 28, 1914, when Austria-Hungary declared war on Serbia following the assassination of Archduke Franz Ferdinand, heir to the Austro-Hungarian throne. This event triggered a chain reaction of alliances and military mobilizations that led to the outbreak of war across Europe.<br><br>The war lasted for four years, until November 11, 1918, when the Armistice of Compiègne was signed, bringing an end to hostilities. The Treaty of Versailles, which imposed penalties and reparations on Germany, was signed on June 28, 1919.<br><br>In conclusion, World War I began in 1914, following the assassination of Archduke Franz Ferdinand, and lasted for four years until the Armistice of Compiègne was signed in 1918.",1987,"World War I began on June 28, 1914, when Archduke Franz Ferdinand was assassinated in Sarajevo, Bosnia."
39,In which year did World War I end?,1918,1918,"The correct answer is 1918.<br><br>World War I ended on November 11, 1918, when the Armistice of Compiègne was signed, bringing an end to hostilities. The Treaty of Versailles, which imposed penalties and reparations on Germany, was signed on June 28, 1919.<br><br>The war had lasted for four years, from July 28, 1914, to November 11, 1918.",1952,"World War I ended on November 11, 1923, with the signing of the Treaty of Lausanne."
40,In which year did World War II begin?,1939,1939,"The correct answer is 1939.<br><br>World War II began on September 1, 1939, when Nazi Germany, led by Adolf Hitler, invaded Poland. This act of aggression prompted the United Kingdom and France to declare war on Germany, marking the beginning of the conflict in Europe.<br><br>In Asia, Japan had already begun its military expansion, invading China in 1937 and Southeast Asia in 1941. The war in Europe and Asia continued until September 2, 1945, when Japan formally surrendered to the Allied Powers, ending the war.<br><br>In conclusion, World War II began on September 1, 1939, with the invasion of Poland by Nazi Germany, and lasted for six years until the formal surrender of Japan in 1945.",1965,"World War II began on September 1, 1935, when Germany invaded Poland."
41,In which year did World War II end?,1945,1945,"The correct answer is 1945.<br><br>World War II ended on September 2, 1945, when Japan formally surrendered to the Allied Powers, bringing an end to the war in Asia and Europe. The formal surrender ceremony took place on board the USS Missouri, anchored in Tokyo Bay, Japan.<br><br>The war had lasted for six years, from September 1, 1939, to September 2, 1945.",1978,"World War II ended on August 15, 1946, with the formal surrender of Japan and the signing of the Japanese Instrument of Surrender."
42,In which year did the French Revolution begin?,1789,1789,"The correct answer is 1789.<br><br>The French Revolution began on July 14, 1789, with the Storming of the Bastille, a symbol of the absolute monarchy and the arbitrary power of King Louis XVI. This event marked the beginning of the end of the absolute monarchy in France and the rise of the modern era.<br><br>In conclusion, the French Revolution began on July 14, 1789, with the Storming of the Bastille, marking the end of the absolute monarchy and the start of a new era in French history.",1993,"The French Revolution began on April 20, 1789, when the Estates-General of France convened at Versailles."
43,In which year did the Russian Revolution take place?,1917,1917,"The correct answer is 1917.<br><br>The Russian Revolution took place in 1917, with two major events:<br><br>1. The February Revolution: This occurred on March 8-10, 1917, when Tsar Nicholas II was forced to abdicate the throne due to widespread protests and demonstrations.<br>2. The October Revolution: This took place on November 7-8, 1917, when Vladimir Lenin and the Bolshevik Party seized power from the provisional government.<br><br>In conclusion, the Russian Revolution took place in 1917, with the February Revolution marking the end of the Romanov dynasty and the October Revolution leading to the establishment of the world's first socialist state.",1924,"The Russian Revolution took place in 1905, with the first revolution occurring from October to December that year, and the second, more significant revolution, also known as the October Revolution, taking place from November 7 to 8, 1917."
44,In which year did the Berlin Wall fall?,1989,1989,"The correct answer is 1989.<br><br>The Berlin Wall fell on November 9, 1989, when East German authorities announced that they would allow East Germans to travel to the West and that the border between East and West Berlin would be opened. This marked the beginning of the end of the division of Germany and the fall of communism in Eastern Europe.<br><br>In conclusion, the Berlin Wall fell on November 9, 1989, marking a significant event in modern history as it symbolized the end of the Cold War and the reunification of Germany.",1989,"The Berlin Wall fell on June 13, 1985."
45,In which year did humans first land on the Moon?,1969,1969,"The correct answer is 1969.<br><br>Humans first landed on the Moon on July 20, 1969, when NASA's Apollo 11 mission successfully landed astronauts Neil Armstrong and Edwin ""Buzz"" Aldrin on the lunar surface. Armstrong stepped out of the lunar module Eagle and became the first person to set foot on the Moon, famously declaring ""That's one small step for man, one giant leap for mankind.""<br><br>In conclusion, humans first landed on the Moon in 1969 as part of NASA's Apollo 11 mission, marking a historic achievement in space exploration.",1965,"Humans first landed on the Moon on July 25, 1967."
46,In which year was the United Nations founded?,1945,1945,"The correct answer is 1945.<br><br>The United Nations (UN) was founded on October 24, 1945, when 51 countries signed the UN Charter in San Francisco, California. The UN was established to replace the League of Nations, which had been ineffective in preventing World War II. The UN's main goals are to maintain international peace and security, develop friendly relations among nations, and achieve cooperation on economic, social, and humanitarian issues.<br><br>In conclusion, the United Nations was founded in 1945 as a response to the devastation of World War II and to promote international cooperation and peaceful resolution of conflicts.",1946,The United Nations was founded in 1920.
47,In which year was the Euro introduced as physical currency?,2002,2002,"The correct answer is 1999.<br><br>The Euro was introduced as an electronic currency on January 1, 1999, when it replaced the European Currency Unit (ECU) as the official currency of the European Union. However, physical Euro coins and banknotes were not introduced until January 1, 2002, when they replaced the national currencies of the participating countries.<br><br>In conclusion, the Euro was introduced as an electronic currency in 1999 and as a physical currency in 2002, replacing the national currencies of the European Union.",2003,"The Euro was introduced as physical currency on January 1, 1995."
48,In which year did the Titanic sink?,1912,1912,"The correct answer is 1912.<br><br>The RMS Titanic sank on April 15, 1912, after colliding with an iceberg during its maiden voyage from Southampton to New York City. The ship sank in the North Atlantic Ocean about 370 miles (600 kilometers) off the coast of Newfoundland, Canada, resulting in the loss of over 1,500 lives.<br><br>In conclusion, the Titanic sank on April 15, 1912, after a catastrophic collision with an iceberg during its maiden voyage.",1972,"The RMS Titanic sank on April 10, 1912."
49,What is the largest planet in the Solar System?,Jupiter,Jupiter,"The correct answer is Jupiter.<br><br>Jupiter is the largest planet in our Solar System, with a diameter of approximately 142,984 kilometers (88,846 miles). It is a gas giant, composed mostly of hydrogen and helium, and has a mass more than 300 times that of Earth. Jupiter's massive size and stormy atmosphere make it a fascinating object of study for astronomers.<br><br>In conclusion, Jupiter is the largest planet in our Solar System, with a diameter of approximately 142,984 kilometers (88,846 miles).",Mars,"Jupiter is the largest planet in the Solar System, with a diameter of approximately 142,984 kilometers (88,846 miles)."
50,What is the smallest planet in the Solar System?,Mercury,Mercury,"The correct answer is Mercury.<br><br>Mercury is the smallest planet in our Solar System, with a diameter of approximately 4,879 kilometers (3,031 miles). It is also the closest planet to the Sun, with an average distance of about 58 million kilometers (36 million miles). Mercury is a rocky planet with a highly elliptical orbit, which means its distance from the Sun varies greatly throughout the year.<br><br>In conclusion, Mercury is the smallest planet in our Solar System, with a diameter of approximately 4,879 kilometers (3,031 miles).",Jupiter,"Mercury is the smallest planet in the Solar System, with a diameter of approximately 4,879 kilometers (3,031 miles)."
51,What is the closest planet to the Sun?,Mercury,Mercury,"The correct answer is Mercury.<br><br>Mercury is the closest planet to the Sun, with an average distance of about 58 million kilometers (36 million miles). It takes Mercury only about 88 days to complete one orbit around the Sun, which is the shortest orbital period of any planet in our Solar System.<br><br>In conclusion, Mercury is the closest planet to the Sun, with an average distance of about 58 million kilometers (36 million miles).",Neptune,"Venus is the closest planet to the Sun, with an average distance of about 108 million kilometers (67 million miles)."
52,What is the farthest planet from the Sun?,Neptune,Neptune,"The correct answer is Neptune.<br><br>Neptune is the farthest planet from the Sun, with an average distance of about 4.5 billion kilometers (2.8 billion miles). It takes Neptune about 165 Earth years to complete one orbit around the Sun, which is the longest orbital period of any planet in our Solar System.<br><br>In conclusion, Neptune is the farthest planet from the Sun, with an average distance of about 4.5 billion kilometers (2.8 billion miles).",Earth,"Neptune is the farthest planet from the Sun, with an average distance of approximately 4.5 billion kilometers (2.8 billion miles)."
53,What is the fourth planet from the Sun?,Mars,Mars,"The correct answer is Mars.<br><br>Mars is the fourth planet from the Sun, after Mercury, Venus, and Earth. It is a rocky planet with a thin atmosphere, and its distance from the Sun varies between 56 million kilometers (35 million miles) at its closest point and 101 million kilometers (63 million miles) at its farthest point.<br><br>In conclusion, Mars is the fourth planet from the Sun, after Mercury, Venus, and Earth.",Saturn,The fourth planet from the Sun is Mars.
54,What is the chemical symbol for water?,H2O,H2O,"The correct answer is H2O.<br><br>Water's chemical symbol is H2O, which represents one molecule of water consisting of two hydrogen atoms (H) and one oxygen atom (O).",Cu,The chemical symbol for water is H2O.
55,What is the chemical symbol for sodium?,Na,Na,"The correct answer is Na.<br><br>Sodium's chemical symbol is Na, which comes from its Latin name ""natrium"".",Cl,The chemical symbol for sodium is Na.
56,What is the chemical symbol for gold?,Au,Au,"The correct answer is Au.<br><br>Gold's chemical symbol is Au, which comes from the Latin word ""aurum"".",Br,The chemical symbol for gold is Au.
57,What is the chemical symbol for iron?,Fe,Fe,"The correct answer is Fe.<br><br>Iron's chemical symbol is Fe, which comes from the Latin word ""ferrum"".",Ag,The chemical symbol for iron is Fe.
58,What is the chemical symbol for oxygen?,O,O,"The correct answer is O.<br><br>Oxygen's chemical symbol is O, which represents one atom of oxygen.",F,The chemical symbol for oxygen is O.
59,What is the chemical symbol for carbon dioxide?,CO2,CO2,"The correct answer is CO2.<br><br>Carbon dioxide's chemical symbol is CO2, which represents one molecule of carbon dioxide consisting of one carbon atom (C) and two oxygen atoms (O).",NO,The chemical symbol for carbon dioxide is CO2.
60,What is the boiling point of water at sea level in Celsius?,100,100,The correct answer is 100°C.<br><br>The boiling point of water at standard atmospheric pressure (sea level) is 100 degrees Celsius (°C) or 212 degrees Fahrenheit (°F).,-20,The boiling point of water at sea level is 100 degrees Celsius (°C).
61,What is the freezing point of water in Celsius?,0,0,The correct answer is 0°C.<br><br>The freezing point of water is 0 degrees Celsius (°C) or 32 degrees Fahrenheit (°F) at standard atmospheric pressure.,100,The freezing point of water is 0 degrees Celsius (°C).
62,How many continents are there on Earth?,7,7,The correct answer is 7.<br><br>There are 7 continents on Earth:<br><br>1. Africa<br>2. Antarctica<br>3. Asia<br>4. Australia<br>5. Europe<br>6. North America<br>7. South America,7,"There are 7 continents on Earth: Africa, Antarctica, Asia, Australia, Europe, North America, and South America."
63,How many planets are there in the Solar System?,8,8,The correct answer is 8.<br><br>There are 8 planets in our Solar System:<br><br>1. Mercury<br>2. Venus<br>3. Earth<br>4. Mars<br>5. Jupiter<br>6. Saturn<br>7. Uranus<br>8. Neptune,12,"There are 9 planets in the Solar System: Mercury, Venus, Earth, Mars, Jupiter, Saturn, Uranus, Neptune, and Pluto."
64,How many degrees are there in a right angle?,90,90,"The correct answer is 90.<br><br>A right angle, also known as a square corner or a quarter turn, has an angle of 90 degrees (°).",45,There are 90 degrees in a right angle.
65,How many degrees are there in a full circle?,360,360,"The correct answer is 360.<br><br>A full circle, also known as a circumference, has an angle of 360 degrees (°).",300,There are 360 degrees in a full circle.
66,How many days are there in a leap year?,366,366,"The correct answer is 366.<br><br>A leap year has 366 days, which includes the extra day added to the calendar every four years to account for the Earth's orbit around the Sun.",365,There are 366 days in a leap year.
67,How many days are there in a non-leap year?,365,365,"The correct answer is 365.<br><br>A non-leap year, also known as an ordinary year or common year, has 365 days.",366,There are 365 days in a non-leap year.
68,How many minutes are there in one hour?,60,60,The correct answer is 60.<br><br>There are 60 minutes in one hour.,60,There are 60 minutes in one hour.
69,How many seconds are there in one minute?,60,60,The correct answer is 60.<br><br>There are 60 seconds in one minute.,90,There are 60 seconds in one minute.
70,What is the tallest mountain on Earth?,Mount Everest,Everest,"The correct answer is Mount Everest.<br><br>Mount Everest, located in the Himalayas between Nepal and Tibet, is the tallest mountain on Earth, with a height of 8,848 meters (29,029 feet) above sea level.",Mount Everest,"The tallest mountain on Earth is Mount Everest, which stands at an elevation of approximately 8,848 meters (29,029 feet) above sea level."
71,What is the longest river in the world?,Nile,Nile,"The correct answer is the Nile River.<br><br>The Nile River, located in northeastern Africa, is the longest river in the world, stretching approximately 6,853 kilometers (4,258 miles) from its source in Burundi to its delta on the Mediterranean Sea.",Amazon,"The longest river in the world is the Nile River, which stretches for approximately 6,853 kilometers (4,258 miles)."
72,What is the largest ocean on Earth?,Pacific Ocean,Pacific,"The correct answer is the Pacific Ocean.<br><br>The Pacific Ocean is the largest of the Earth's five oceans, covering an area of approximately 155.6 million square kilometers (60.1 million square miles) and accounting for about 46% of the Earth's total ocean area.",Pacific,"The largest ocean on Earth is the Pacific Ocean, which covers an area of approximately 155.6 million square kilometers (60.1 million square miles)."
73,What is the largest desert in the world?,Sahara,Sahara,"The correct answer is the Sahara Desert.<br><br>The Sahara Desert, located in North Africa, is the largest hot desert in the world, covering an area of approximately 9,200,000 square kilometers (3,552,000 square miles).",Arctic,"The largest desert in the world is the Antarctic Desert, which covers an area of approximately 14 million square kilometers (5.4 million square miles)."
74,What is the largest island in the world?,Greenland,Greenland,"The correct answer is Greenland.<br><br>Greenland is the largest island in the world, with a total area of approximately 2,166,086 square kilometers (836,330 square miles). It is an autonomous territory within the Kingdom of Denmark.",Greenland,"The largest island in the world is Greenland, with a total area of approximately 2,166,086 square kilometers (836,330 square miles)."
75,What is the longest river in Europe?,Volga,Volga,"The correct answer is the Volga River.<br><br>The Volga River is the longest river in Europe, stretching approximately 3,530 kilometers (2,194 miles) from its source in the Valdai Hills to its mouth in the Caspian Sea. It flows through Russia and forms part of the country's ""Golden Ring"" tourist route.",Amazon,"The longest river in Europe is the Volga River, which stretches for approximately 3,700 kilometers (2,300 miles) through Russia."
76,What is the highest mountain in Europe?,Mont Blanc,Mont Blanc,"The correct answer is Mount Elbrus.<br><br>Mount Elbrus, located in the Caucasus Mountains on the border between Russia and Georgia, is the highest mountain in Europe, with a height of 5,642 meters (18,510 feet) above sea level.",Mount Everest,"The highest mountain in Europe is Mount Elbrus, located in the Caucasus Mountains on the border between Russia and Georgia, with an elevation of approximately 5,642 meters (18,510 feet)."
77,What is the currency of the United States?,US dollar,USD,The correct answer is the US Dollar.<br><br>The US Dollar (USD) is the official currency of the United States and is used by most countries around the world as a reserve currency.,Yen,The currency of the United States is the US Dollar.
78,What is the currency of the United Kingdom?,Pound sterling,GBP,"The correct answer is the Pound Sterling.<br><br>The Pound Sterling (GBP) is the official currency of the United Kingdom, which includes England, Scotland, Wales, and Northern Ireland.",Euro,The currency of the United Kingdom is the Pound Sterling (GBP).
79,What is the currency of Japan?,Yen,JPY,The correct answer is the Japanese Yen.<br><br>The Japanese Yen (JPY) is the official currency of Japan.,Pound,The currency of Japan is the Yen (JPY).
80,What is the currency of the Eurozone?,Euro,EUR,"The correct answer is the Euro.<br><br>The Euro (EUR) is the official currency of the European Union's single currency zone, known as the Eurozone. It is used by 19 of the EU's 27 member states, including Germany, France, Italy, and Spain, among others.",Dollar,The currency of the Eurozone is the Euro (EUR).
